{
  "version": 1,
  "reviewStatus": "pending-render-acceptance",
  "geometry": {
    "format": "urbe-highway-content",
    "version": "1.0.0",
    "uvUnits": "metres",
    "roadUv": "u-left-to-right-metres-v-horizontal-station-metres"
  },
  "normalConvention": "opengl-positive-y",
  "scalarMaps": "absolute-linear-values",
  "placementWeathering": {
    "mode": "disabled-until-owner-coordinates",
    "reason": "No baked base bands, no global-height cutoff, and no station inferred from swept UVs. Pier/support ownership and joint-local coordinates need an explicit consumer contract."
  },
  "textures": {
    "asphalt-basecolor": {
      "path": "themes/cyberpunk/assets/street-asphalt/mid/worn/basecolor.png",
      "resolution": [
        1024,
        1024
      ],
      "sha256": "1494a7792f54e980f897b5d6c951cbe6fd341fe28cf34a8300212a50df837748",
      "colorSpace": "srgb",
      "wrap": [
        "repeat",
        "repeat"
      ],
      "ktx2": "themes/cyberpunk/assets/street-asphalt/mid/worn/basecolor.ktx2",
      "ktx2Sha256": "dca5f5abdb9e0b99341bc61533685560aa41a8dd7f1ecd33f2dee0b3a1b19635"
    },
    "asphalt-normal": {
      "path": "themes/cyberpunk/assets/street-asphalt/mid/worn/normal.png",
      "resolution": [
        1024,
        1024
      ],
      "sha256": "d8442fa11a4769769d2deda1de647fcae5499f3e8753cb72f0e29d5cb284ad37",
      "colorSpace": "linear",
      "wrap": [
        "repeat",
        "repeat"
      ],
      "ktx2": "themes/cyberpunk/assets/street-asphalt/mid/worn/normal.ktx2",
      "ktx2Sha256": "a6f0ea4b7e052ea3df710cba2496a518562b80cc67e301609ee2286ed579b348"
    },
    "asphalt-roughness": {
      "path": "themes/cyberpunk/assets/street-asphalt/mid/worn/roughness.png",
      "resolution": [
        1024,
        1024
      ],
      "sha256": "9bedc2c0e63e4a02fc62138456315733ae88c9271fb7e74b2f801f0b7bb80e61",
      "colorSpace": "linear",
      "wrap": [
        "repeat",
        "repeat"
      ],
      "ktx2": "themes/cyberpunk/assets/street-asphalt/mid/worn/roughness.ktx2",
      "ktx2Sha256": "b05bff6c6a0a2dc932478c6864b0f0dbb5392e64d2a2f6bcf07f82815c8fa367"
    },
    "asphalt-ao": {
      "path": "themes/cyberpunk/assets/street-asphalt/mid/worn/ao.png",
      "resolution": [
        1024,
        1024
      ],
      "sha256": "3726669209940c424e22722caf47c69f83a1a62578df0f1da6fddf5179aa14a0",
      "colorSpace": "linear",
      "wrap": [
        "repeat",
        "repeat"
      ],
      "ktx2": "themes/cyberpunk/assets/street-asphalt/mid/worn/ao.ktx2",
      "ktx2Sha256": "de9c49800190edf7e5ab04e85f252864173a6395411a3abbe8a3413017ffdcd1"
    },
    "asphalt-clean-basecolor": {
      "path": "themes/cyberpunk/assets/street-asphalt/mid/clean/basecolor.png",
      "resolution": [
        1024,
        1024
      ],
      "sha256": "1494a7792f54e980f897b5d6c951cbe6fd341fe28cf34a8300212a50df837748",
      "colorSpace": "srgb",
      "wrap": [
        "repeat",
        "repeat"
      ],
      "ktx2": "themes/cyberpunk/assets/street-asphalt/mid/clean/basecolor.ktx2",
      "ktx2Sha256": "dca5f5abdb9e0b99341bc61533685560aa41a8dd7f1ecd33f2dee0b3a1b19635"
    },
    "asphalt-clean-normal": {
      "path": "themes/cyberpunk/assets/street-asphalt/mid/clean/normal.png",
      "resolution": [
        1024,
        1024
      ],
      "sha256": "d8442fa11a4769769d2deda1de647fcae5499f3e8753cb72f0e29d5cb284ad37",
      "colorSpace": "linear",
      "wrap": [
        "repeat",
        "repeat"
      ],
      "ktx2": "themes/cyberpunk/assets/street-asphalt/mid/clean/normal.ktx2",
      "ktx2Sha256": "a6f0ea4b7e052ea3df710cba2496a518562b80cc67e301609ee2286ed579b348"
    },
    "highway-concrete-formed-basecolor": {
      "path": "themes/cyberpunk/assets/highway-concrete/mid/formed/basecolor.png",
      "sha256": "397c082c165a1252c315a0ad04822bae170a72c6dbbf483c71c64386c5859aae",
      "resolution": [
        1024,
        1024
      ],
      "colorSpace": "srgb",
      "wrap": [
        "repeat",
        "repeat"
      ],
      "ktx2": "themes/cyberpunk/assets/highway-concrete/mid/formed/basecolor.ktx2",
      "ktx2Sha256": "10ed7216c812d31872a76ef3bd1d87cb4ede8d31d25e2f64b2371c4e0b8a213d"
    },
    "highway-concrete-formed-normal": {
      "path": "themes/cyberpunk/assets/highway-concrete/mid/formed/normal.png",
      "sha256": "e8c367647521c619709d1dac781884570b3e155060a818b877604bfd88390fc7",
      "resolution": [
        1024,
        1024
      ],
      "colorSpace": "linear",
      "wrap": [
        "repeat",
        "repeat"
      ],
      "ktx2": "themes/cyberpunk/assets/highway-concrete/mid/formed/normal.ktx2",
      "ktx2Sha256": "d3c44c3bc20f208cf37774ad53d7ef842e5e3ea970c2bf7f3eb0b7f30c4f0a04"
    },
    "highway-concrete-formed-roughness": {
      "path": "themes/cyberpunk/assets/highway-concrete/mid/formed/roughness.png",
      "sha256": "82a2b996f0ed385fa9de0267eedc874f5aef358fea5aee8f337dd2f2af83b5f9",
      "resolution": [
        1024,
        1024
      ],
      "colorSpace": "linear",
      "wrap": [
        "repeat",
        "repeat"
      ],
      "ktx2": "themes/cyberpunk/assets/highway-concrete/mid/formed/roughness.ktx2",
      "ktx2Sha256": "9436df425245225503c72d9e2276b9d24473dced66859c6b0d659ec27ce8a609"
    },
    "highway-concrete-formed-metallic": {
      "path": "themes/cyberpunk/assets/highway-concrete/mid/formed/metallic.png",
      "sha256": "a3acee77059e3c784c727f5bbee93338ed98fdc5e05ba57fcf31220a3511894d",
      "resolution": [
        1024,
        1024
      ],
      "colorSpace": "linear",
      "wrap": [
        "repeat",
        "repeat"
      ],
      "ktx2": "themes/cyberpunk/assets/highway-concrete/mid/formed/metallic.ktx2",
      "ktx2Sha256": "4013169221dc823d38676f9118b0ab7ab5ad57b6a079669aa291460b53307baa"
    },
    "highway-concrete-formed-height": {
      "path": "themes/cyberpunk/assets/highway-concrete/mid/formed/height.png",
      "sha256": "bbeb39aa0e430cd6412c6b9e8867c7b663f80e76e8f04135157bdae446d9307e",
      "resolution": [
        1024,
        1024
      ],
      "colorSpace": "linear",
      "wrap": [
        "repeat",
        "repeat"
      ],
      "ktx2": "themes/cyberpunk/assets/highway-concrete/mid/formed/height.ktx2",
      "ktx2Sha256": "61a549f01ac33ece3be6859282c70d43f28bc4422d09e93fb0af9bdd8be9c173"
    },
    "highway-concrete-formed-ao": {
      "path": "themes/cyberpunk/assets/highway-concrete/mid/formed/ao.png",
      "sha256": "3a3abbec27f46570a46decb22d4fe9d2b9f5a0a26c029b36d79dd58d69041ffc",
      "resolution": [
        1024,
        1024
      ],
      "colorSpace": "linear",
      "wrap": [
        "repeat",
        "repeat"
      ],
      "ktx2": "themes/cyberpunk/assets/highway-concrete/mid/formed/ao.ktx2",
      "ktx2Sha256": "a8b0944f2f7c8a3d94225eea6d9a928b3e64b899c02dd9945524c76df7ff5ca7"
    },
    "highway-concrete-formed-metallicRoughness": {
      "path": "themes/cyberpunk/assets/metallic-roughness/573d4c52f3383a3a71396177040abcf775ae8a2e1448b74fab01859aa4b682d6.png",
      "sha256": "f7a4cef09fbc99211b3a16b08ee8c08088858dc0e7cc1295b4e6b16fda5653d9",
      "resolution": [
        1024,
        1024
      ],
      "colorSpace": "linear",
      "wrap": [
        "repeat",
        "repeat"
      ],
      "ktx2": "themes/cyberpunk/assets/metallic-roughness/573d4c52f3383a3a71396177040abcf775ae8a2e1448b74fab01859aa4b682d6.ktx2",
      "ktx2Sha256": "0f76415cc069e43da60fdd30fc29fb7e55b4f6e8ef44ee5dcc8315b3c54759cb"
    },
    "highway-concrete-soffit-basecolor": {
      "path": "themes/cyberpunk/assets/highway-concrete/mid/soffit/basecolor.png",
      "sha256": "e347f9d7b165d4c98710193365b0b2d85094e3312f4800801dab4493701b12c5",
      "resolution": [
        1024,
        1024
      ],
      "colorSpace": "srgb",
      "wrap": [
        "repeat",
        "repeat"
      ],
      "ktx2": "themes/cyberpunk/assets/highway-concrete/mid/soffit/basecolor.ktx2",
      "ktx2Sha256": "cd432b1b9d43cc22f965d0020fe6c387cfaa20e3fda576a657a6ac3c9a31088a"
    },
    "highway-concrete-soffit-normal": {
      "path": "themes/cyberpunk/assets/highway-concrete/mid/soffit/normal.png",
      "sha256": "89ce0f85c009f1f100bd45cadf722887a8866bf5c10ae4e6caf04ca30e06d621",
      "resolution": [
        1024,
        1024
      ],
      "colorSpace": "linear",
      "wrap": [
        "repeat",
        "repeat"
      ],
      "ktx2": "themes/cyberpunk/assets/highway-concrete/mid/soffit/normal.ktx2",
      "ktx2Sha256": "709a4a58fc55abe90dca3582b8b11a06ee92e364ce1d3a665a6496baa0891393"
    },
    "highway-concrete-soffit-roughness": {
      "path": "themes/cyberpunk/assets/highway-concrete/mid/soffit/roughness.png",
      "sha256": "f9ba143e6b9f513b6fb0b14495d32089e7fc27b9322c6d61b16353f0a0e89be1",
      "resolution": [
        1024,
        1024
      ],
      "colorSpace": "linear",
      "wrap": [
        "repeat",
        "repeat"
      ],
      "ktx2": "themes/cyberpunk/assets/highway-concrete/mid/soffit/roughness.ktx2",
      "ktx2Sha256": "5bfb2985830c6ebfac280ba3cefa73f4e8d4f0c80c27620de9044e5667e921cd"
    },
    "highway-concrete-soffit-metallic": {
      "path": "themes/cyberpunk/assets/highway-concrete/mid/soffit/metallic.png",
      "sha256": "a3acee77059e3c784c727f5bbee93338ed98fdc5e05ba57fcf31220a3511894d",
      "resolution": [
        1024,
        1024
      ],
      "colorSpace": "linear",
      "wrap": [
        "repeat",
        "repeat"
      ],
      "ktx2": "themes/cyberpunk/assets/highway-concrete/mid/soffit/metallic.ktx2",
      "ktx2Sha256": "4013169221dc823d38676f9118b0ab7ab5ad57b6a079669aa291460b53307baa"
    },
    "highway-concrete-soffit-height": {
      "path": "themes/cyberpunk/assets/highway-concrete/mid/soffit/height.png",
      "sha256": "1f39a0cbd19e87d78feec50ab745b9b478b273d8b5126d907060b0b6525bdd2d",
      "resolution": [
        1024,
        1024
      ],
      "colorSpace": "linear",
      "wrap": [
        "repeat",
        "repeat"
      ],